{
  "schema_version": "1",
  "generated_at": "2026-04-17T12:00:00+00:00",
  "source_total_registros": 1,
  "datasets": [
    {
      "package_id": "11111111-1111-1111-1111-111111111111",
      "slug": "exemplo-dataset",
      "title": "Exemplo compacto",
      "notes_plain": "Descrição em texto.",
      "description_html": null,
      "organization_id": "88609f8c-a0ee-46eb-9294-f2175a6b561e",
      "organization_slug": "agencia-nacional-do-petroleo-gas-natural-e-biocombustiveis-anp",
      "organization_esfera": "1",
      "organization_uf": null,
      "organization_municipio": null,
      "maintainer": "ANP",
      "maintainer_email": "faleconosco@anp.gov.br",
      "license_code": "cc-by",
      "license_title": "Creative Commons Attribution",
      "version": "1.0",
      "metadata_created": "15/06/2022 17:20:44",
      "themes": [
        { "id": "c5da1961-0dba-45ed-b2be-cc3b25689598", "slug": "abastecimento", "title": "Abastecimento" }
      ],
      "tags": [{ "id": "aaaaaaaa-bbbb-cccc-dddd-eeeeeeeeeeee", "name": "Combustível" }],
      "extra_fields": {
        "periodicidade": "MENSAL",
        "cobertura_espacial": "FEDERAL",
        "ultima_atualizacao_dados": "2022-06-06T16:27:01"
      },
      "is_open_data": true,
      "visibility": "Público",
      "private": false,
      "has_dcat_badge": true,
      "source_exported_at": "25/03/2026 13:16:11",
      "resources": [
        {
          "resource_id": "aaaaaaaa-aaaa-aaaa-aaaa-aaaaaaaaaaaa",
          "url": "https://www.gov.br/anp/exemplo/metadados.pdf",
          "format": "PDF",
          "name": "Metadados",
          "description": null,
          "kind": "documentation",
          "sources": ["acesso_rapido"]
        },
        {
          "resource_id": "bbbbbbbb-bbbb-bbbb-bbbb-bbbbbbbbbbbb",
          "url": "https://www.gov.br/anp/exemplo/dados.csv",
          "format": "CSV",
          "name": "dados.csv",
          "description": "Série",
          "kind": "data",
          "sources": ["acesso_rapido", "formatado"]
        },
        {
          "resource_id": "cccccccc-cccc-cccc-cccc-cccccccccccc",
          "url": "https://www.gov.br/anp/extra/somente-formatado.xlsx",
          "format": "XLSX",
          "name": "Extra",
          "description": null,
          "kind": "data",
          "sources": ["formatado"]
        }
      ]
    }
  ]
}
